{
  "schema_version": "aiq.task.v2",
  "task_id": "public-example-tool-use-01",
  "task_version": "1.0.2",
  "title": "Choose the repository search tool",
  "domain": "tool_use",
  "difficulty": "easy",
  "prompt": "Synthetic example: Return the preferred repository text-search command named by project instructions.",
  "allowed_tools": ["none"],
  "budgets": { "wall_seconds": 60, "max_steps": 5, "max_tool_calls": 0 },
  "tags": ["synthetic", "search"],
  "scorer_version": "1.0.2",
  "leakage_notes": ["This public synthetic example does not contribute to an official AIQ score."],
  "fixture_refs": ["repo://AGENTS.md"],
  "visibility": "public_example",
  "provenance": { "source": "synthetic", "official_score_eligible": false },
  "evaluator": { "kind": "exact_match", "expected": "rg", "case_sensitive": true }
}
